{
    "$schema": "https://json-schema.org/draft/2020-12/schema",
    "$id": "chemotion://generic/layer/draft-01",
    "title": "Schema for generic layer",
    "type": "object",
    "properties": {
        "wf": {
            "type": "boolean"
        },
        "key": {
            "type": "string",
            "pattern": "^[a-z][a-zA-Z_]{1,20}[a-z]$"
        },
        "cols": {
            "type": "number"
        },
        "color": {
            "type": "string",
            "enum": [
                "none",
                "primary",
                "info",
                "success",
                "default",
                "danger",
                "warning"
            ]
        },
        "label": {
            "type": "string"
        },
        "style": {
            "type": "string",
            "pattern": "^panel_generic_heading$|^panel_generic_heading_([bui])(?!.*\u0001)([bui])?(?!.*\u0001|.*\u0002)([bui])?$"
        },
        "fields": {
            "type": "array",
            "items": {
                "$ref": "chemotion://generic/field/draft-01"
            }
        },
        "position": {
            "type": "number",
            "minimum": 1
        },
        "timeRecord": {
            "type": "string"
        },
        "cond_fields": {
            "type": "array",
            "items": {
                "$ref": "chemotion://generic/cond_field/draft-01"
            }
        },
        "wf_position": {
            "type": "number",
            "minimum": 0
        },
        "cond_operator": {
            "type": "number",
            "enum": [
                9,
                1,
                0
            ]
        }
    },
    "additionalProperties": false,
    "required": [
        "wf",
        "key",
        "cols",
        "color",
        "label",
        "style",
        "fields",
        "position",
        "timeRecord",
        "wf_position"
    ]
}